{
  "schemaVersion": "3.0.0",
  "id": "template-source-2024-a-7",
  "revision": 6,
  "title": "DBMSのACID特性",
  "baseQuestionRef": {
    "questionId": "question-template-source-2024-a-7",
    "revision": 6
  },
  "generatorRef": {
    "id": "generator-source-2024-a-7",
    "version": "3.2.0"
  },
  "parameterDomain": {
    "values": {
      "length": 2,
      "minimum": 0,
      "maximum": 3
    },
    "fields": [
      {
        "name": "問う対象・判定する条件",
        "minimum": 0,
        "maximum": 3
      },
      {
        "name": "選択肢の配置",
        "minimum": 0,
        "maximum": 2
      }
    ]
  },
  "referenceParameters": {
    "values": [
      0,
      0
    ]
  },
  "attribution": {
    "origin": "adapted",
    "sourceRefs": [
      {
        "sourceId": "source-ipa-2024-a-qs",
        "locator": {
          "section": "科目A 公開問題 問7",
          "page": 4,
          "exam": "基本情報技術者試験",
          "year": 2024,
          "subject": "科目A",
          "questionNumber": "7"
        }
      }
    ],
    "rightsRefs": [
      "rights-ipa-2024-a",
      "rights-original"
    ],
    "creatorIds": [
      "codex"
    ]
  },
  "editorIds": [
    "codex"
  ],
  "lifecycle": "active",
  "distribution": "included",
  "bindingBasis": "official_source",
  "originalContentSha256": "6565873ebfb05c969f53c2adbe0b6864c5875cb625411a23bf4e03b0f0ae721b"
}
