{
  "schemaVersion": "3.0.0",
  "id": "template-source-sample-2022-dec-a-52",
  "revision": 4,
  "title": "経営の概念",
  "baseQuestionRef": {
    "questionId": "question-template-source-sample-2022-dec-a-52",
    "revision": 4
  },
  "generatorRef": {
    "id": "generator-source-sample-2022-dec-a-52",
    "version": "3.2.0"
  },
  "parameterDomain": {
    "values": {
      "length": 1,
      "minimum": 0,
      "maximum": 3
    },
    "fields": [
      {
        "name": "問う対象",
        "minimum": 0,
        "maximum": 3
      }
    ]
  },
  "referenceParameters": {
    "values": [
      0
    ]
  },
  "attribution": {
    "origin": "adapted",
    "sourceRefs": [
      {
        "sourceId": "source-ipa-sample-2022-dec-a-qs",
        "locator": {
          "section": "科目A試験サンプル問題 問52",
          "page": 26,
          "exam": "基本情報技術者試験",
          "period": "2022年12月公表 サンプル問題",
          "subject": "科目A",
          "questionNumber": "52"
        }
      }
    ],
    "rightsRefs": [
      "rights-ipa-sample-2022-dec-a",
      "rights-original"
    ],
    "creatorIds": [
      "codex"
    ]
  },
  "editorIds": [
    "codex"
  ],
  "lifecycle": "active",
  "distribution": "included",
  "bindingBasis": "official_source",
  "originalContentSha256": "2f656780b4fbc8e65c63aeb8c1c0524bc543ce9ebaa497376c39347d40bcdaf3"
}
