{
  "schemaVersion": "3.0.0",
  "id": "template-source-sample-2022-dec-b-5",
  "revision": 2,
  "title": "べき乗関数の合成",
  "baseQuestionRef": {
    "questionId": "question-template-source-sample-2022-dec-b-5",
    "revision": 2
  },
  "generatorRef": {
    "id": "generator-source-sample-2022-dec-b-5",
    "version": "3.2.0"
  },
  "parameterDomain": {
    "values": {
      "length": 1,
      "minimum": 2,
      "maximum": 4
    },
    "fields": [
      {
        "name": "根とべきの次数",
        "minimum": 2,
        "maximum": 4
      }
    ]
  },
  "referenceParameters": {
    "values": [
      2
    ]
  },
  "attribution": {
    "origin": "adapted",
    "sourceRefs": [
      {
        "sourceId": "source-ipa-sample-2022-dec-b-qs",
        "locator": {
          "section": "科目B試験サンプル問題 問5",
          "page": 8,
          "exam": "基本情報技術者試験",
          "period": "2022年12月公表 サンプル問題",
          "subject": "科目B",
          "questionNumber": "5"
        }
      }
    ],
    "rightsRefs": [
      "rights-ipa-sample-2022-dec-b",
      "rights-original"
    ],
    "creatorIds": [
      "codex"
    ]
  },
  "editorIds": [
    "codex"
  ],
  "lifecycle": "active",
  "distribution": "included",
  "bindingBasis": "official_source",
  "originalContentSha256": "6546046b774028995fd124d6507b161a8e4cebba972f78f6a5f6a40942bba556"
}
