{
  "schemaVersion": "3.0.0",
  "id": "template-source-sample-2022-dec-b-15",
  "revision": 2,
  "title": "三目並べのミニマックス評価",
  "baseQuestionRef": {
    "questionId": "question-template-source-sample-2022-dec-b-15",
    "revision": 2
  },
  "generatorRef": {
    "id": "generator-source-sample-2022-dec-b-15",
    "version": "3.2.0"
  },
  "parameterDomain": {
    "values": {
      "length": 2,
      "minimum": 0,
      "maximum": 3
    },
    "fields": [
      {
        "name": "勝敗の評価値の5点単位",
        "minimum": 1,
        "maximum": 3
      },
      {
        "name": "AとBを付ける根の子",
        "minimum": 0,
        "maximum": 2
      }
    ]
  },
  "referenceParameters": {
    "values": [
      2,
      0
    ]
  },
  "attribution": {
    "origin": "adapted",
    "sourceRefs": [
      {
        "sourceId": "source-ipa-sample-2022-dec-b-qs",
        "locator": {
          "section": "科目B試験サンプル問題 問15",
          "page": 24,
          "exam": "基本情報技術者試験",
          "period": "2022年12月公表 サンプル問題",
          "subject": "科目B",
          "questionNumber": "15"
        }
      }
    ],
    "rightsRefs": [
      "rights-ipa-sample-2022-dec-b",
      "rights-original"
    ],
    "creatorIds": [
      "codex"
    ]
  },
  "editorIds": [
    "codex"
  ],
  "lifecycle": "active",
  "distribution": "included",
  "bindingBasis": "official_source",
  "originalContentSha256": "b73e5a3f6e94d7610846605bf89e3fe785eab0602435c153fdbdc66ed41d66a8"
}
