{
  "schemaVersion": "3.0.0",
  "id": "template-source-2017h29h-fe-pm-11",
  "revision": 1,
  "title": "旧制度・午後：Javaによる段階料金と割引プラン",
  "baseQuestionRef": {
    "questionId": "question-template-source-2017h29h-fe-pm-11",
    "revision": 1
  },
  "generatorRef": {
    "id": "generator-source-2017h29h-fe-pm-11",
    "version": "3.2.0"
  },
  "parameterDomain": {
    "values": {
      "length": 1,
      "minimum": 0,
      "maximum": 2
    },
    "fields": [
      {
        "name": "料金表・電力量の条件",
        "minimum": 0,
        "maximum": 2
      }
    ]
  },
  "referenceParameters": {
    "values": [
      0
    ]
  },
  "attribution": {
    "origin": "adapted",
    "sourceRefs": [
      {
        "sourceId": "source-ipa-2017h29h-fe-pm-11-qs",
        "locator": {
          "section": "平成29年度 春期 基本情報技術者試験 午後 問11",
          "page": 52,
          "year": 2017,
          "period": "春期",
          "exam": "基本情報技術者試験",
          "subject": "午後",
          "timeSlot": "午後",
          "questionNumber": "11"
        }
      },
      {
        "sourceId": "source-ipa-2017h29h-fe-pm-11-qs",
        "locator": {
          "section": "平成29年度 春期 基本情報技術者試験 午後 問11",
          "page": 53,
          "year": 2017,
          "period": "春期",
          "exam": "基本情報技術者試験",
          "subject": "午後",
          "timeSlot": "午後",
          "questionNumber": "11"
        }
      },
      {
        "sourceId": "source-ipa-2017h29h-fe-pm-11-qs",
        "locator": {
          "section": "平成29年度 春期 基本情報技術者試験 午後 問11",
          "page": 54,
          "year": 2017,
          "period": "春期",
          "exam": "基本情報技術者試験",
          "subject": "午後",
          "timeSlot": "午後",
          "questionNumber": "11"
        }
      },
      {
        "sourceId": "source-ipa-2017h29h-fe-pm-11-qs",
        "locator": {
          "section": "平成29年度 春期 基本情報技術者試験 午後 問11",
          "page": 55,
          "year": 2017,
          "period": "春期",
          "exam": "基本情報技術者試験",
          "subject": "午後",
          "timeSlot": "午後",
          "questionNumber": "11"
        }
      },
      {
        "sourceId": "source-ipa-2017h29h-fe-pm-11-qs",
        "locator": {
          "section": "平成29年度 春期 基本情報技術者試験 午後 問11",
          "page": 56,
          "year": 2017,
          "period": "春期",
          "exam": "基本情報技術者試験",
          "subject": "午後",
          "timeSlot": "午後",
          "questionNumber": "11"
        }
      },
      {
        "sourceId": "source-ipa-2017h29h-fe-pm-11-qs",
        "locator": {
          "section": "平成29年度 春期 基本情報技術者試験 午後 問11",
          "page": 57,
          "year": 2017,
          "period": "春期",
          "exam": "基本情報技術者試験",
          "subject": "午後",
          "timeSlot": "午後",
          "questionNumber": "11"
        }
      }
    ],
    "rightsRefs": [
      "rights-ipa-2017h29h-fe-pm-11",
      "rights-original"
    ],
    "creatorIds": [
      "codex"
    ]
  },
  "editorIds": [
    "codex"
  ],
  "lifecycle": "active",
  "distribution": "included",
  "bindingBasis": "official_source",
  "originalContentSha256": "ee1f9bd4977caa0647e083c205ab7c4382a56d19c104312fdbac8fb436af2067"
}
