{
  "schemaVersion": "3.0.0",
  "id": "template-source-2025-b-4",
  "revision": 7,
  "title": "文字列検索の比較回数",
  "baseQuestionRef": {
    "questionId": "question-template-source-2025-b-4",
    "revision": 7
  },
  "generatorRef": {
    "id": "generator-source-2025-b-4",
    "version": "3.4.0"
  },
  "parameterDomain": {
    "values": {
      "length": 2,
      "minimum": 0,
      "maximum": 5
    },
    "fields": [
      {
        "name": "検索対象の並び",
        "minimum": 0,
        "maximum": 5
      },
      {
        "name": "検索キー",
        "minimum": 0,
        "maximum": 5
      }
    ]
  },
  "referenceParameters": {
    "values": [
      0,
      0
    ]
  },
  "attribution": {
    "origin": "adapted",
    "sourceRefs": [
      {
        "sourceId": "source-ipa-2025-b-qs",
        "locator": {
          "section": "科目B 公開問題 問4",
          "page": 10,
          "exam": "基本情報技術者試験",
          "year": 2025,
          "subject": "科目B",
          "questionNumber": "4"
        }
      }
    ],
    "rightsRefs": [
      "rights-ipa-2025-b",
      "rights-original"
    ],
    "creatorIds": [
      "codex"
    ]
  },
  "editorIds": [
    "codex"
  ],
  "lifecycle": "active",
  "distribution": "included",
  "bindingBasis": "official_source",
  "originalContentSha256": "a48acd76233b38db6067c3b53dd383f01a3cdf7d6855d19349673a855988938d"
}
