{
  "schemaVersion": "3.0.0",
  "id": "template-source-sample-2022-dec-a-6",
  "revision": 4,
  "title": "配列の回転",
  "baseQuestionRef": {
    "questionId": "question-template-source-sample-2022-dec-a-6",
    "revision": 4
  },
  "generatorRef": {
    "id": "generator-source-sample-2022-dec-a-6",
    "version": "3.2.0"
  },
  "parameterDomain": {
    "values": {
      "length": 2,
      "minimum": 0,
      "maximum": 3
    },
    "fields": [
      {
        "name": "変換",
        "minimum": 0,
        "maximum": 3
      },
      {
        "name": "元の模様",
        "minimum": 0,
        "maximum": 2
      }
    ]
  },
  "referenceParameters": {
    "values": [
      3,
      0
    ]
  },
  "attribution": {
    "origin": "adapted",
    "sourceRefs": [
      {
        "sourceId": "source-ipa-sample-2022-dec-a-qs",
        "locator": {
          "section": "科目A試験サンプル問題 問6",
          "page": 7,
          "exam": "基本情報技術者試験",
          "period": "2022年12月公表 サンプル問題",
          "subject": "科目A",
          "questionNumber": "6"
        }
      }
    ],
    "rightsRefs": [
      "rights-ipa-sample-2022-dec-a",
      "rights-original"
    ],
    "creatorIds": [
      "codex"
    ]
  },
  "editorIds": [
    "codex"
  ],
  "lifecycle": "active",
  "distribution": "included",
  "bindingBasis": "official_source",
  "originalContentSha256": "7f73c5777393d41bceaf8acdae3dc40c4063730c093565e7432758fb8d2c9398"
}
