{
  "schemaVersion": "3.0.0",
  "id": "template-source-2026-a-20",
  "revision": 7,
  "title": "著作権と著作者人格権",
  "baseQuestionRef": {
    "questionId": "question-template-source-2026-a-20",
    "revision": 7
  },
  "generatorRef": {
    "id": "generator-source-2026-a-20",
    "version": "3.2.0"
  },
  "parameterDomain": {
    "values": {
      "length": 1,
      "minimum": 0,
      "maximum": 3
    },
    "fields": [
      {
        "name": "利用する行為と契約条件",
        "minimum": 0,
        "maximum": 3
      }
    ]
  },
  "referenceParameters": {
    "values": [
      0
    ]
  },
  "attribution": {
    "origin": "adapted",
    "sourceRefs": [
      {
        "sourceId": "source-ipa-2026-a-qs",
        "locator": {
          "section": "科目A 公開問題 問20",
          "page": 13,
          "exam": "基本情報技術者試験",
          "year": 2026,
          "subject": "科目A",
          "questionNumber": "20"
        }
      }
    ],
    "rightsRefs": [
      "rights-ipa-2026-a",
      "rights-original"
    ],
    "creatorIds": [
      "codex"
    ]
  },
  "editorIds": [
    "codex"
  ],
  "lifecycle": "active",
  "distribution": "included",
  "bindingBasis": "official_source",
  "originalContentSha256": "572c17ea8ba264863f111a6acc9ea3a65de3756f56328f5cc7e8a8f0647aa0a6"
}
