{
  "schemaVersion": "3.0.0",
  "id": "template-count-multiples",
  "revision": 6,
  "title": "区間内の倍数を数える",
  "baseQuestionRef": {
    "questionId": "question-template-count-multiples",
    "revision": 6
  },
  "generatorRef": {
    "id": "generator-count-multiples",
    "version": "2.3.0"
  },
  "parameterDomain": {
    "values": {
      "length": 3,
      "minimum": 1,
      "maximum": 250
    },
    "fields": [
      {
        "name": "下限n",
        "minimum": 1,
        "maximum": 100
      },
      {
        "name": "上限m",
        "minimum": 11,
        "maximum": 250
      },
      {
        "name": "除数",
        "minimum": 2,
        "maximum": 12
      }
    ]
  },
  "referenceParameters": {
    "values": [
      1,
      12,
      4
    ]
  },
  "attribution": {
    "origin": "adapted",
    "sourceRefs": [
      {
        "sourceId": "source-ipa-2025-b-qs",
        "locator": {
          "section": "科目B 公開問題 問1",
          "page": 4,
          "exam": "基本情報技術者試験",
          "year": 2025,
          "subject": "科目B",
          "questionNumber": "1"
        }
      }
    ],
    "rightsRefs": [
      "rights-ipa-2025-b",
      "rights-original"
    ],
    "creatorIds": [
      "codex"
    ]
  },
  "editorIds": [
    "codex"
  ],
  "lifecycle": "active",
  "distribution": "included",
  "bindingBasis": "official_source",
  "originalContentSha256": "f3b484a78b45ca1cb8ed4f1a319a633168edf098e64dda707d0ea954209de410"
}
