{
  "schemaVersion": "3.0.0",
  "id": "template-source-2017h29a-fe-pm-1",
  "revision": 1,
  "title": "旧制度・午後：SSHによる通信",
  "baseQuestionRef": {
    "questionId": "question-template-source-2017h29a-fe-pm-1",
    "revision": 1
  },
  "generatorRef": {
    "id": "generator-source-2017h29a-fe-pm-1",
    "version": "3.2.0"
  },
  "parameterDomain": {
    "values": {
      "length": 1,
      "minimum": 0,
      "maximum": 2
    },
    "fields": [
      {
        "name": "誤答が表す通信上の誤解",
        "minimum": 0,
        "maximum": 2
      }
    ]
  },
  "referenceParameters": {
    "values": [
      0
    ]
  },
  "attribution": {
    "origin": "adapted",
    "sourceRefs": [
      {
        "sourceId": "source-ipa-2017h29a-fe-pm-1-qs",
        "locator": {
          "section": "平成29年度 秋期 基本情報技術者試験 午後 問1",
          "page": 6,
          "year": 2017,
          "period": "秋期",
          "exam": "基本情報技術者試験",
          "subject": "午後",
          "timeSlot": "午後",
          "questionNumber": "1"
        }
      },
      {
        "sourceId": "source-ipa-2017h29a-fe-pm-1-qs",
        "locator": {
          "section": "平成29年度 秋期 基本情報技術者試験 午後 問1",
          "page": 7,
          "year": 2017,
          "period": "秋期",
          "exam": "基本情報技術者試験",
          "subject": "午後",
          "timeSlot": "午後",
          "questionNumber": "1"
        }
      },
      {
        "sourceId": "source-ipa-2017h29a-fe-pm-1-qs",
        "locator": {
          "section": "平成29年度 秋期 基本情報技術者試験 午後 問1",
          "page": 8,
          "year": 2017,
          "period": "秋期",
          "exam": "基本情報技術者試験",
          "subject": "午後",
          "timeSlot": "午後",
          "questionNumber": "1"
        }
      }
    ],
    "rightsRefs": [
      "rights-ipa-2017h29a-fe-pm-1",
      "rights-original"
    ],
    "creatorIds": [
      "codex"
    ]
  },
  "editorIds": [
    "codex"
  ],
  "lifecycle": "active",
  "distribution": "included",
  "bindingBasis": "official_source",
  "originalContentSha256": "4173ea6d8cfda5d8f6350804badb7dbeaf8d448111aa8594f8274ee789a5f4c9"
}
